번호,문제,보기1,보기2,보기3,보기4,정답,해설
60,"항공보안법의 적용 범위 및 관할권(법 제3조, 제4조 등)에 관한 설명으로 가장 올바른 것은?",대한민국 영토 밖에 있는 대한민국의 항공기 내에서 항공보안법을 위반한 외국인에게는 대한민국의 재판권이 미치지 않으므로 이 법을 적용할 수 없다.,"군사 작전 목적의 군용항공기가 일시적으로 민간 공항에 착륙한 경우, 해당 군용기 내부는 항공보안법이 일반법으로서 최우선 적용된다.",대한민국 영공을 단순히 통과 중인 외국 항공기 내에서 발생한 외국인 간의 폭력 사건은 항공보안법에 따라 무조건 대한민국 공항으로 강제 착륙시켜 처벌해야 한다.,"이 법은 불법방해행위로부터 민간항공의 안전을 확보하기 위한 것으로, 경찰 업무 및 군(軍) 업무에 사용되는 항공기에는 원칙적으로 적용하지 아니한다.",4,"정답: 4
해설: 항공보안법 제3조에 따라 세관, 경찰, 군 업무에 사용되는 항공기에는 적용하지 않는 것이 원칙입니다. 대한민국 항공기 내 범죄는 국적 불문 적용되며, 영공 통과 외국 항공기에 대한 무조건적 강제착륙 규정은 없습니다."
61,"항공기 강탈죄 및 항로변경죄(법 제41조, 제42조)에 대한 설명으로 가장 옳지 않은 것은?",폭행 등으로 운항 중이 아닌 항공기를 강탈한 자는 1년 이상의 유기징역에 처한다.,위계나 위력으로 운항 중인 항공기의 항로를 변경하게 한 자는 1년 이상 10년 이하의 징역에 처한다.,항공기 강탈죄를 범하여 사람을 상해에 이르게 한 경우에는 무기 또는 5년 이상의 징역에 처한다.,위 죄들의 미수범은 원칙적으로 처벌하지 아니한다.,4,"정답: 4
해설: 항공보안법 제45조에 따라 항공기 납치죄, 강탈죄, 항로변경죄 등의 미수범은 처벌합니다."
62,항공보안 자율신고 제도(법 제31조의3)에 대한 설명으로 가장 옳지 않은 것은?,누구든지 항공보안에 위해가 될 우려가 있는 사실을 국토교통부장관에게 신고할 수 있다.,"자율신고는 접수의 투명성을 위해 신고자의 실명, 직장, 연락처 등을 반드시 명시한 기명 신고만을 대상으로 한다.",장관은 자율신고를 한 사람의 의사에 반하여 그의 신분을 공개해서는 안 된다.,공항운영자등은 자율신고를 이유로 소속 직원에게 해고나 징계 등의 불이익 조치를 해서는 안 된다.,2,"정답: 2
해설: 자율신고는 익명으로도 할 수 있으며, 신고자의 신분 보호를 엄격하게 규정하고 있습니다."
63,항공보안법상 품질관리 활동(법 제31조) 중 '보안감찰(Inspection)'의 정의로 가장 정확한 것은?,항공보안 활동에 대한 법령 및 국가항공보안계획 등의 전반적인 이행 실태를 확인하는 것,"공항, 항공기, 보안시설 등에서 항공보안 조치가 규정대로 이행되고 있는지를 불시에 점검하는 것",모의 무기 또는 모의 폭발물 등을 이용하여 항공보안 조치의 실효성을 확인하는 것,새로운 항공보안 위협에 대하여 보안조치 요구사항을 파악하기 위해 보안 취약성을 분석하는 것,2,"정답: 2
해설: 1번은 보안평가(Audit), 2번은 보안감찰(Inspection), 3번은 보안테스트(Test), 4번은 보안조사(Survey)의 정의입니다."
64,보안검색 면제 및 검색방법의 특례에 대한 설명으로 옳지 않은 것은?,생명 유지에 위험이 발생할 수 있는 환자에 대하여 의사의 소견서가 있는 경우 보호구역 진입 시 보안검색을 전부 면제할 수 있다.,"골수, 이식용 장기 등 보안검색장비를 통과하게 하는 것이 부적절한 물품은 육안 검색 등 다른 방법으로 검색할 수 있다.",체포된 범인을 호송하는 경찰관은 신분과 임무 확인을 거쳐 보안검색의 일부를 달리 적용받을 수 있다.,국가 원수나 외교행낭 등은 국제 조약 및 관례에 따라 보안검색을 생략할 수 있다.,1,"정답: 1
해설: 환자의 경우 생명 유지 장치 등으로 일반 검색장비 통과가 곤란할 때 '검색방법의 특례(촉수검색 등)'를 적용할 수 있는 것이지, 보안검색 자체를 '전부 면제'하는 것은 아닙니다."
65,항공기 내 무기 반입 절차에 관한 설명으로 가장 옳지 않은 것은?,법령에 따라 무기 반입을 허가받은 자는 비행 중 해당 무기를 사용할 필요가 있는 경우 기장의 사전 승인 절차를 거쳐야 한다.,무기를 반입하려는 자는 원칙적으로 실탄을 제거하고 무기와 실탄을 분리하여 포장해야 한다.,허가를 받아 무기를 기내에 적재한 경우에는 기장에게 무기 적재 사실과 그 위치를 알려야 한다.,승객의 안전을 위해 무기를 반입한 자의 신원과 무기 적재 위치를 객실 안내방송을 통해 모든 승객에게 공지하여야 한다.,4,"정답: 4
해설: 무기 적재 및 무장보안요원 탑승 사실 등은 보안 유지 사항이므로 일반 승객에게 공지해서는 안 됩니다."
66,보호구역 진입 및 통제 절차 위반 시 제재(법 제54조 등)로 옳은 것은?,정당한 사유 없이 임시출입증 소지자를 에스코트하지 않고 방치한 자는 징역형에 처한다.,정당한 사유 없이 다른 사람의 출입증을 빌려 사용한 자는 1천만원 이하의 과태료에 처한다.,무단으로 보호구역에 침입한 여객은 항공보안법 위반이 아닌 건조물침입죄로만 처벌받는다.,보안검색을 받지 않고 보호구역에 진입한 자에 대해서는 어떠한 경우에도 과태료 부과 없이 현장 훈방 조치만 가능하다.,2,"정답: 2
해설: 법 제54조에 따라 타인의 출입증 사용 등은 1천만원 이하 과태료 대상입니다. 보호구역에 무단출입하거나 검색을 피한 경우에도 처벌 및 과태료 조항이 존재합니다."
67,승객 및 위탁수하물의 일치성 확인(BRS)에 대한 설명 중 틀린 것은?,항공운송사업자는 탑승권을 발급받은 승객이 위탁수하물만 맡기고 항공기에 탑승하지 않은 경우 원칙적으로 해당 수하물을 항공기에서 내려야 한다.,"여객 본인의 명시적인 서면 동의가 있다면, 탑승하지 않은 승객의 위탁수하물도 하기(Unload)하지 않고 목적지로 운송할 수 있다.",화물칸에 실린 수하물이 누구의 것인지 식별 불가능한 이른바 '주인 없는 수하물'은 항공기에 적재하여서는 안 된다.,환승객의 수하물에 대해서도 전 여정 승객의 탑승 여부를 확인하여 수하물 일치성 검사를 이행하여야 한다.,2,"정답: 2
해설: 보안상 테러 위험(수하물 폭발물 적재 후 본인 탑승 포기)을 방지하기 위한 강행규정이므로, 여객의 동의 여부와 무관하게 미탑승 승객의 수하물은 반드시 내려야 합니다."
68,항공기 내 불법방해행위 시 항로변경 및 비상착륙에 대한 설명으로 옳은 것은?,항공기 내에서 승객이 난동을 부리는 경우 기장은 법적 의무로서 즉시 가장 가까운 공항으로 회항 또는 비상착륙하여야 한다.,"기장은 항공기, 승객 등의 안전을 보호하기 위해 필요하다고 인정하는 경우 항로를 변경하여 인근 공항에 착륙할 수 있는 재량권이 있다.",항로변경을 결정한 경우 기장은 착륙 전 반드시 해당 불법행위자의 동의를 얻어 관할 경찰서에 무선으로 통보해야 한다.,불법행위자가 승무원 제압에 순응한 경우에는 이미 발생한 폭행 사실이 있더라도 경찰관서에 인도할 수 없다.,2,"정답: 2
해설: 비상착륙이나 항로변경은 기장의 고유한 권한이자 재량적 판단 사항이며 무조건적인 의무가 아닙니다. 불법행위자는 사후 순응 여부와 관계없이 착륙 후 경찰에 인도해야 합니다."
69,"항공보안법 적용 범위(법 제3조, 제4조)에 관한 상황 중 이 법이 적용되지 않는 경우는?",대한민국 영토 밖에 있는 대한민국의 항공기 내에서 승무원을 폭행한 외국인 승객,인천국제공항 보호구역 내에서 보안검색 요원의 지시를 거부한 내국인 출입자,한미 연합훈련을 위해 군용기를 조종 중인 공군 조종사의 군사 기밀 누설 행위,운항 중인 대한민국 국적 민간 여객기 내에서 기장의 업무를 방해한 무국적자,3,"정답: 3
해설: 세관, 경찰 업무 및 군(軍) 업무에 사용되는 항공기 및 관련 시설에 대해서는 항공보안법을 적용하지 않습니다(군형법 등 적용)."
70,항공보안법에 규정된 '비행 중'인 항공기의 기준은?,승객이 탑승하기 시작한 순간부터 모든 승객이 내릴 때까지,항공기의 시동을 켠 때부터 엔진을 완전히 정지할 때까지,이륙을 목적으로 항공기의 문을 닫은 때부터 착륙 후 승객이 내리기 위하여 문을 열 때까지,항공기가 활주로에 진입한 때부터 착륙하여 활주로를 벗어날 때까지,3,"정답: 3
해설: 국제협약 및 항공보안법 등에서 '비행 중'이라 함은 이륙 목적으로 문을 닫은 때부터 내리기 위해 문을 열 때까지를 의미합니다(현재 법률 용어는 운항 중으로 통일되는 추세이나, 전통적 비행 중 개념은 3번과 같습니다)."
71,화물터미널 등에서의 화물 보안검색에 관한 설명 중 가장 옳지 않은 것은?,항공운송사업자는 화물터미널에 반입된 화물을 항공기에 싣기 전에 보안검색을 하여야 한다.,엑스선 검색장비로 화물을 검색할 때 내부가 너무 빽빽하여 식별이 곤란한 경우 개봉검색 등 다른 방법을 추가로 사용하여야 한다.,"상용화주가 보안검색을 완료한 후 화물을 봉인하여 인계한 경우, 어떠한 파손 흔적이 있더라도 항공운송사업자는 화물 지연을 막기 위해 재검색 없이 탑재해야 한다.",생동물 등 일반적인 엑스선 검색이 부적합한 화물에 대해서는 폭발물흔적탐지 등 별도의 검색방법을 적용할 수 있다.,3,"정답: 3
해설: 상용화주가 보안검색을 마친 화물이라도 봉인이 훼손되었거나 조작 흔적이 발견된 경우에는 반드시 보안검색을 다시 실시하여야 합니다."
72,우범여행자 정보 시스템과 개인정보 보호 조치에 관한 설명으로 틀린 것은?,"국토교통부장관, 관할 경찰관서장, 국가정보원장은 우범여행자 정보를 제공받은 목적 외의 용도로 사용하여서는 아니 된다.",정보 제공 요청을 받은 항공운송사업자는 해당 여객이 정보 제공에 동의하지 않는다는 이유로 정보 제공을 거부할 수 있다.,제공받은 우범여행자 정보는 항공보안의 목적을 달성한 후 지체 없이 파기하여야 한다.,"우범여행자란 국제테러범, 마약밀수 사범 등 항공보안에 위해를 가할 우려가 있는 자를 말한다.",2,"정답: 2
해설: 우범여행자 정보 제공은 항공보안법상 의무 사항이므로 정보 주체의 동의가 없다는 이유로 항공운송사업자가 제공을 거부할 수 없습니다."
73,승객의 기내 위해물품 적발 시 항공운송사업자의 조치사항으로 옳지 않은 것은?,"위해물품을 적발한 경우, 승객에게 해당 물품의 포기, 기탁수하물 전환 등 가능한 처리 방법을 안내하여야 한다.",승객이 해당 위해물품의 포기를 거부하고 지속적으로 기내 반입을 시도할 경우 운송을 거절할 수 있다.,"포기된 위해물품은 항공운송사업자가 폐기할 수 있으며, 이 경우 폐기 처분 대장을 작성하여 1년간 보관하여야 한다.",보안검색 과정에서 가위 등 일반 위해물품이 적발된 승객은 테러 의심자로 간주하여 즉각 관할 경찰서로 호송해야 한다.,4,"정답: 4
해설: 가위 등 일상적인 위해물품 반입 시도는 고의성 없는 규정 미숙지인 경우가 많으므로 물품 보관/폐기/기탁 전환 등으로 처리하며 무조건 체포/호송하는 것은 아닙니다."
74,항공운송사업자의 운송 거절 사유(법 제22조)에 명시적으로 해당하지 않는 것은?,승객이 항공운송사업자의 정당한 신원확인 요구에 불응하는 경우,승객이 항공운송사업자 또는 공항운영자등의 보안검색을 거부하는 경우,특정 승객의 탑승이 항공기 테러 방지를 위해 필요하다고 장관이 긴급히 지시한 경우,승객이 기내에서 무료로 제공되는 식음료의 추가 제공을 거부당해 가볍게 불만을 표시한 경우,4,"정답: 4
해설: 식음료 불만 등 단순한 항의는 항공보안법상 운송 거절의 법적 근거가 되는 항공보안 위협이나 지시 불응에 해당하지 않습니다."
75,국가항공보안프로그램에 따른 보호구역 출입통제의 원칙으로 가장 옳은 것은?,모든 공항 직원은 정규 출입증 하나만 발급받으면 전국 모든 공항의 모든 보안통제구역을 자유롭게 출입할 수 있다.,보호구역에 출입하는 차량은 반드시 공항운영자가 인가한 차량 출입증을 지정된 위치에 부착하여야 한다.,14세 미만의 아동은 에스코트 없이 단독으로 보호구역에 임시출입증을 발급받아 출입할 수 있다.,공항 내 식당 등 일반구역(Public Area)에서 근무하는 직원도 예외 없이 보호구역 정규 출입증을 발급받아야만 출근이 가능하다.,2,"정답: 2
해설: 1번은 출입증 등급/구역별 권한 제한 위반, 3번은 14세 미만 단독 출입 불가, 4번은 일반구역 근무자는 보호구역 출입증 불필요. 인가된 차량 출입증 부착은 필수 규정입니다."
76,기장 등의 직무방해(법 제46조) 범죄 성립 요건 중 '운항 중인 항공기'에서 발생한 행위가 아닌 것은?,승객이 탑승 완료 후 모든 문이 닫힌 상태에서 이륙 대기 중 승무원을 폭행하여 안전을 해친 경우,비행 중인 상공에서 기장을 위력으로 협박하여 항공기의 항로를 강제로 변경하도록 지시한 경우,착륙하여 유도로를 이동 중이나 아직 여객 하기를 위해 출입문이 열리지 않은 상태에서 기기 조작을 시도한 경우,"비행이 완전히 종료되고 모든 승객이 내린 후, 정비고에 주기된 빈 항공기 내에서 정비사를 폭행한 경우",4,"정답: 4
해설: 항공보안법상 '운항 중'은 승객 탑승 후 문이 닫힌 때부터 내리기 위해 문을 열 때까지이므로, 빈 항공기 내에서의 폭행은 기장 등 직무방해죄(법 제46조)가 아닌 일반 형법 등이 적용됩니다."
77,항공보안법상 보안검색요원에 대한 설명으로 가장 옳지 않은 것은?,공항운영자등은 법령에 따른 초기교육 및 직무교육을 이수한 자만을 보안검색요원으로 지정하여야 한다.,보안검색요원이 업무를 수행할 때에는 승객의 인권을 존중해야 하며 규정된 검색 절차를 준수하여야 한다.,보안검색요원의 업무 역량 강화를 위해 매 1년마다 정기교육을 실시하여야 한다.,공항 보안검색요원은 항공보안법에 따라 사법경찰관의 직무를 수행할 수 있는 권한을 자동으로 부여받는다.,4,"정답: 4
해설: 보안검색요원은 민간인 신분으로 경비업법 등에 따른 보안 업무를 수행할 뿐, 사법경찰권(체포, 압수수색 권한)을 자동으로 부여받지는 않습니다."
78,공항 내 불법방해행위 발생 시 우발계획(Contingency Plan)에 따른 초동 조치 주체는?,관할 세관장,해당 공항의 공항운영자,국가정보원장,국방부장관,2,"정답: 2
해설: 공항 내에서 불법방해행위가 발생할 경우, 공항운영자가 자체 우발계획에 따라 초동 조치(승객 대피, 현장 통제, 관계기관 전파 등)를 주도적으로 수행해야 합니다."
79,"항공보안법상 '폭행, 협박 또는 그 밖의 방법으로 비행 중인 항공기를 강탈하거나 그 운항을 통제'한 사람에 대한 처벌 규정(항공기 납치죄)의 명칭과 형량으로 가장 옳은 것은?","항공기 강탈죄, 무기 또는 5년 이상의 징역","항공기 납치죄, 무기 또는 7년 이상의 징역","항로 변경죄, 1년 이상 10년 이하의 징역","항공기 파괴죄, 사형 또는 무기징역",2,"정답: 2
해설: 법 제40조(항공기 납치죄)에 따라 비행 중인 항공기를 강탈하거나 운항을 통제한 자는 무기 또는 7년 이상의 징역에 처합니다."
80,상용화주(Known Consignor)의 지정을 취소해야만 하는 필수(기속) 사유에 해당하는 것은?,보안검색 장비의 사소한 고장이 발생한 경우,화물보안관리자가 일시적인 질병으로 1주일간 휴가를 낸 경우,거짓이나 그 밖의 부정한 방법으로 상용화주 지정을 받은 경우,지정받은 후 1개월 동안 항공화물 운송 실적이 없는 경우,3,"정답: 3
해설: 법 제17조의2 제5항에 따라 '거짓이나 부정한 방법으로 지정을 받은 경우'는 반드시 지정을 취소하여야 하는 필요적 취소 사유입니다."
81,항공보안법상 '불법방해행위'의 정의(법 제2조 제8호)에 명시적으로 포함되지 않는 것은?,운항 중인 항공기의 납치,운항 중인 항공기 내에서의 사람에 대한 폭력행위,공항 내에서의 폭력행위,항공기 내에서의 단순 흡연 및 소란행위,4,"정답: 4
해설: 항공보안법 제2조에 따른 불법방해행위는 항공기 납치, 파괴, 인질 억류, 공항 내 폭력행위 등을 말하며, 단순 흡연이나 고성방가는 승객의 협조의무 위반으로 별도 규율됩니다."
82,공항운영자등이 수립하는 자체보안계획의 변경 및 제출에 대한 설명으로 가장 옳지 않은 것은?,자체보안계획을 수립하거나 중요 사항을 변경하려는 경우 국토교통부장관의 승인을 받아야 한다.,자체보안계획의 내용 중 연락처 변경 등 대통령령으로 정하는 경미한 사항을 변경한 경우에는 사후에 장관에게 신고할 수 있다.,경미한 사항의 변경 신고는 그 변경사유가 발생한 날부터 30일 이내에 하여야 한다.,"외국항공운송사업자는 자체보안계획을 수립할 의무가 없으며, 자국의 국가항공보안계획 사본만 제출하면 승인된 것으로 간주한다.",4,"정답: 4
해설: 대한민국에 취항하는 외국항공운송사업자 역시 자국 정부의 승인을 받았더라도 대한민국 법령에 부합하는 자체보안계획을 수립하여 국토교통부장관에게 제출 및 승인(접수)을 받아야 합니다."
83,항공보안법령상 공항보안협의회에 대한 설명으로 옳지 않은 것은?,공항운영자는 공항의 보안대책 등을 협의하기 위하여 공항별로 공항보안협의회를 두어야 한다.,공항보안협의회의 위원장은 관할 지방항공청장이 맡아 총괄한다.,"협의회에는 국가정보원, 관할 경찰관서, 세관 등 관계 행정기관의 소속 직원이 위원으로 참여한다.",협의회는 우범여행자의 정보 공유 및 공항 자체보안계획의 이행에 관한 사항을 협의한다.,2,"정답: 2
해설: 항공보안법 시행령 제8조에 따라 공항보안협의회의 위원장은 관할 지방항공청장이 아니라 '해당 공항운영자의 장'이 됩니다."
84,항공보안법령상 보안검색요원의 교육훈련에 대한 설명으로 가장 옳지 않은 것은?,보안검색요원이 되려는 자는 국토교통부장관이 지정한 교육기관에서 초기교육을 받아야 한다.,보안검색요원은 업무 수행 능력을 유지하기 위하여 매년 정기교육을 받아야 한다.,정기교육을 받지 아니한 자는 교육을 이수할 때까지 보안검색 업무를 수행할 수 없다.,초기교육을 이수한 후 6개월 이상 보안검색 업무를 수행하지 않은 자는 정기교육만 이수하면 즉시 업무에 복귀할 수 있다.,4,"정답: 4
해설: 보안검색요원이 6개월 이상 해당 업무를 수행하지 않은 경우, 정기교육만으로 복귀할 수 없으며 '초기교육'을 다시 받거나 그에 준하는 '복귀교육' 등의 별도 절차를 거쳐야 현장에 투입될 수 있습니다."
85,"국제선 항공기에 탑승하는 승객의 액체, 분무, 겔류 반입 통제 기준(보안검색)으로 가장 옳지 않은 것은?",승객 1명당 1리터 이하의 투명한 비닐 지퍼백 1개에 한하여 반입이 허용된다.,비닐 지퍼백 내에 담긴 각각의 액체류 용기는 100밀리리터 이하이어야 한다.,"의약품, 유아용 음식 등은 비행 여정에 적합한 용량에 한하여 100밀리리터를 초과하더라도 반입을 허용할 수 있다.",공항 면세점에서 구입하여 훼손탐지기능봉투(STEB)에 밀봉된 액체류는 어떠한 경우라도 최종 목적지 도착 전에 개봉검색을 실시해서는 안 된다.,4,"정답: 4
해설: STEB에 밀봉된 면세품의 경우 원칙적으로 개봉을 지양하나, 폭발물 의심 등 보안상 명백한 위협이 판단되는 특별한 사유가 있는 경우에는 예외적으로 개봉검색을 실시할 수 있습니다."
86,항공보안법상 강화된 항공기 보안수색(Aircraft Security Search)을 의무적으로 실시해야 하는 대상이 아닌 것은?,운항을 마치고 여객이 모두 내린 후 특별한 위협 없이 24시간 이상 정비고에 체류 예정인 항공기,폭발물 등 테러 위협 정보를 접수한 항공기,국가항공보안프로그램에서 정하는 우범국가에서 출발하여 국내에 도착하는 항공기,타인이 무단으로 접근하거나 침입한 사실이 확인된 항공기,1,"정답: 1
해설: 운항 종료 후 일반 체류(주기) 중인 항공기는 일반적인 보안점검 또는 접근통제 대상일 뿐, 테러 위협이나 침입 발생 등 특별한 보안 사유가 없는 한 강화된 '보안수색'의 의무 대상은 아닙니다."
87,기장등의 항공기 내 직무방해(법 제46조) 및 관련 형벌에 대한 설명 중 옳은 것은?,기장등의 업무를 방해하여 항공기 안전을 해친 자에 대한 벌금형의 상한은 5천만원이다.,기장등의 업무를 방해하였으나 다행히 항공기와 승객의 안전을 해치지는 않은 경우 처벌을 면제한다.,"폭행, 협박 또는 위계, 위력으로 기장등의 직무 집행을 방해한 자는 안전 저해 여부와 상관없이 무조건 10년 이하의 징역에만 처한다.",기장등의 정당한 직무 집행을 방해하여 운항 중인 항공기와 승객의 안전을 해친 자는 10년 이하의 징역 또는 1억원 이하의 벌금에 처한다.,4,"정답: 4
해설: 법 제46조에 따라, 직무방해로 항공기와 승객의 안전을 해친 자는 10년 이하 징역 또는 1억원 이하 벌금에 처합니다. 안전을 해치지 않은 단순 방해도 처벌 조항(5년 이하 징역 등)이 존재합니다."
88,무기 등의 반입 허가(법 제14조)와 관련된 내용으로 틀린 것은?,법무부 소속 교도관이 범인 호송을 위해 무기를 기내에 반입하려면 관할 권한권자의 사전 허가를 받아야 한다.,무기를 기내로 반입하는 경우 원칙적으로 무기와 실탄을 분리하여 포장해야 한다.,임무 수행을 위해 무장보안요원이 무기를 휴대하고 기내에 탑승하는 경우 기장에게 그 사실을 통보할 필요가 없다.,무장보안요원의 기내 무기 휴대는 관할 지방항공청장의 별도 허가증 없이도 허가를 받은 것으로 법률상 의제된다.,3,"정답: 3
해설: 무기를 기내에 반입하거나 무장보안요원이 무기를 휴대하고 탑승하는 경우, 항공기의 최고 안전 책임자인 기장에게 무기 탑재 사실과 좌석 위치 등을 반드시 사전에 통보해야 합니다."
89,항공보안법상 항공운송사업자가 행하는 위탁수하물 보안검색에 관한 설명으로 가장 옳지 않은 것은?,항공운송사업자는 위탁수하물을 항공기에 싣기 전에 엑스선 검색장비 등을 이용하여 보안검색을 실시해야 한다.,위탁수하물의 보안검색 과정에서 폭발물이 의심되는 경우 여객의 입회하에 개봉검색을 할 수 있다.,"항공운송사업자는 위탁수하물 검색 업무를 자체 결정만으로 민간 용역업체에 위탁할 수 있으며, 위탁 즉시 항공운송사업자의 법적 관리감독 책임은 전면 면제된다.",폭발물 등 긴급한 사유로 여객의 입회가 불가능한 경우 경찰관 및 폭발물처리요원 등 관계자 입회하에 강제로 개봉할 수 있다.,3,"정답: 3
해설: 항공운송사업자가 보안검색 업무를 경비업자 등에게 위탁할 수는 있으나(법 제32조), 위탁하더라도 보안 사고 등에 대한 항공운송사업자의 법적 책임 및 관리감독 의무가 면제되는 것은 절대 아닙니다."
